image,record_id,matched_record,match_confidence,match_status,overall_status,primary_issue,field,expected,detected,field_status,match_type,field_confidence,explanation,processing_time_seconds,match_notes
tequila_cleanValid_label.png,6,Sierra Azul,100,Auto Match,Needs Review,Government Warning: Missing,Brand Name,Sierra Azul,Sierra Azul,Pass,Fuzzy,100,Brand Name matches after fuzzy comparison.,1.6,High-confidence match found.
tequila_cleanValid_label.png,6,Sierra Azul,100,Auto Match,Needs Review,Government Warning: Missing,Class / Type,Tequila,Tequila,Pass,Fuzzy,100,Class / Type matches after fuzzy comparison.,1.6,High-confidence match found.
tequila_cleanValid_label.png,6,Sierra Azul,100,Auto Match,Needs Review,Government Warning: Missing,Alcohol Content,40% Alc./Vol.,40% alc./vol.,Pass,Normalized Exact,100,Alcohol Content matches the expected value after normalization.,1.6,High-confidence match found.
tequila_cleanValid_label.png,6,Sierra Azul,100,Auto Match,Needs Review,Government Warning: Missing,Net Contents,750 mL,750 ml,Pass,Normalized Exact,100,Net Contents matches the expected value after normalization.,1.6,High-confidence match found.
tequila_cleanValid_label.png,6,Sierra Azul,100,Auto Match,Needs Review,Government Warning: Missing,Government Warning,GOVERNMENT WARNING:,,Missing,Strict,0,Government warning was not found in the OCR text.,1.6,High-confidence match found.
